{
  "accepted_risks": [
    {
      "deadline": "before publication",
      "owner": "human-release-owner",
      "risk": "local provenance is unsigned",
      "rollback_safety": "no external action has occurred",
      "support_boundary_effect": "protected workflow must attach GitHub attestation"
    }
  ],
  "artifact_digests": [
    {
      "name": "adlc-0.9.0-py3-none-any.whl",
      "sha256": "2761c6d6d2bcffb7e955150aa74637e1138aa67c2f88bd93bb7cd4a1f9943dea",
      "size": 195110
    },
    {
      "name": "adlc-0.9.0.tar.gz",
      "sha256": "7244aacf01aa4075c748e42c12f43f6e4b58caf944ad921477645ba58b52795a",
      "size": 197987
    }
  ],
  "audited_at": "2026-07-15T10:27:08.368861Z",
  "auditor": {
    "auditor_id": "codex-independent-go-live-auditor",
    "auditor_session_id": "codex-cli-audit-20260715-02",
    "basis": "separate_session",
    "executor_id": "codex-primary-migration-executor",
    "executor_session_id": "codex-root-20260715-mig-val",
    "identity_evidence_sha256": "9550058c31be0a8c666bc857951c030506353daf212a81ca7151b40ed389352d"
  },
  "clean_install_matrix": [
    {
      "providers": [
        "codex",
        "claude"
      ],
      "python": "3.9",
      "status": "pass"
    },
    {
      "providers": [
        "codex",
        "claude"
      ],
      "python": "3.13",
      "status": "pass"
    }
  ],
  "contract_version": "1.0.0",
  "contradicted_claims": [],
  "doc_honesty_section": "This report validates one immutable candidate locally and does not perform publication.",
  "external_actions": [
    {
      "action": "pypi_upload",
      "approval_required": true,
      "environment": "pypi",
      "status": "pending_human_approval"
    },
    {
      "action": "github_release",
      "approval_required": true,
      "environment": "github-release",
      "status": "pending_human_approval"
    },
    {
      "action": "pages_deploy",
      "approval_required": true,
      "environment": "github-pages",
      "status": "pending_human_approval"
    },
    {
      "action": "launch_communication",
      "approval_required": true,
      "environment": "launch",
      "status": "pending_human_approval"
    }
  ],
  "limitations": [
    "Live provider support remains limited to the exact Codex Fix configuration and rerun named in this report.",
    "Protected publication provenance and external availability do not exist until separately approved workflows complete."
  ],
  "no_overclaim": "The recommendation applies only to the recorded support scope and is not GA, adoption, or future-provider proof.",
  "recommendation": "scoped_beta",
  "release_tag": "v0.9.0",
  "report_artifacts": {
    "completion_audit": "docs/evidence/releases/completion-audit.json",
    "go_live_validation": "docs/evidence/releases/go-live-validation.json"
  },
  "rollback_result": {
    "manifest_ref": "release-out/v0.9.0/rollback-manifest.json",
    "mode": "local-test-index-candidate-restore",
    "prior_public_release": null,
    "reinstall_verified": true,
    "status": "pass"
  },
  "source_commit": "5ae01782a2205a698cc7c4ef5b2095433c28fbb1",
  "status": "pass",
  "support_scope": [
    {
      "dimensions": {
        "behavior": "pass",
        "end_to_end": "pass",
        "installation": "pass",
        "invocation": "pass"
      },
      "evidence_refs": [
        "docs/evidence/releases/go-live-validation.json#/support_scope/0/validation_runs/0",
        "docs/evidence/releases/go-live-validation.json#/support_scope/0/validation_runs/1",
        "docs/evidence/releases/go-live-validation.json#/support_scope/0/validation_runs/2"
      ],
      "failed_runs": 0,
      "fixture_sha256": "4d9f3f1a94b0fa86476b4344c62ec961365d32b0e86b6e7a07ed4dbd706fcfd2",
      "harness": "codex-cli-installed-skill",
      "label": "beta",
      "loop": "fix",
      "model": "gpt-5.4",
      "provider": "codex",
      "provider_version": "0.137.0",
      "run_count": 3,
      "source_commit": "5ae01782a2205a698cc7c4ef5b2095433c28fbb1",
      "validation_kind": "tag_live_rerun",
      "validation_runs": [
        {
          "adapter": {
            "path": "scripts/adlc_runtime/adapters/codex.sh",
            "sha256": "56e554f46f8d464a3a4ae75d4a8f9f9ffb033048cce582edacb5f5ad0ddf12f9"
          },
          "analysis": {
            "assertions": {
              "bounded_diff": true,
              "green_after": true,
              "product_fix": true,
              "provider_exit": true,
              "provider_test_trace": true,
              "red_before": true,
              "structured_trace": true
            },
            "changed_paths": [
              "app/calculator.py"
            ],
            "provider_test_command_count": 2,
            "provider_test_exit_codes": [
              1,
              0
            ],
            "status": "pass"
          },
          "auth_path": "codex-account-session",
          "contract_version": "1.0.0",
          "cost": {
            "currency": "USD",
            "max": 0.0,
            "min": 0.0
          },
          "cost_estimate_tokens": 113316,
          "credential_status": "available",
          "dimensions": {
            "behavior": "pass",
            "end_to_end": "pass",
            "installation": "pass",
            "invocation": "pass"
          },
          "duration_ms": 55425,
          "evidence_status": "current_conformance",
          "failures": [],
          "finished_at": "2026-07-15T10:25:39.537832+00:00",
          "fixture_sha256": "4d9f3f1a94b0fa86476b4344c62ec961365d32b0e86b6e7a07ed4dbd706fcfd2",
          "harness": "codex-cli-installed-skill",
          "limitations": [
            "Bundled-account execution does not expose a marginal USD charge, so cost is reported as zero with token usage retained.",
            "One disposable arithmetic Fix does not prove Build or Review loop conformance."
          ],
          "loop": "fix",
          "model": "gpt-5.4",
          "no_overclaim": "This run applies only to the named Codex CLI, model, installed skill, Fix fixture, commit, and date.",
          "overall": "pass",
          "provider": "codex",
          "provider_version": "0.137.0",
          "run_id": "codex-fix-5ae01782a220-1",
          "runtime": "codex",
          "source_commit": "5ae01782a2205a698cc7c4ef5b2095433c28fbb1",
          "source_tree_clean": true,
          "stages": [
            {
              "artifact": ".agents/skills/adlc",
              "duration_ms": 0,
              "name": "install",
              "ok": true
            },
            {
              "artifact": "trace",
              "duration_ms": 55425,
              "name": "provider_invocation",
              "ok": true
            },
            {
              "artifact": "app/calculator.py",
              "duration_ms": 0,
              "name": "red_green_fix",
              "ok": true
            }
          ],
          "started_at": "2026-07-15T10:24:44.064956+00:00",
          "status": "pass",
          "stderr": "Reading additional input from stdin...\n2026-07-15T10:24:44.297563Z ERROR codex_models_manager::cache: failed to load models cache: unknown variant `max`, expected one of `none`, `minimal`, `low`, `medium`, `high`, `xhigh` at line 29 column 25\n2026-07-15T10:24:57.806511Z ERROR codex_models_manager::manager: failed to renew cache TTL: unknown variant `max`, expected one of `none`, `minimal`, `low`, `medium`, `high`, `xhigh` at line 29 column 25\n2026-07-15T10:25:06.229871Z ERROR codex_models_manager::manager: failed to renew cache TTL: unknown variant `max`, expected one of `none`, `minimal`, `low`, `medium`, `high`, `xhigh` at line 29 column 25\n2026-07-15T10:25:14.361017Z ERROR codex_models_manager::manager: failed to renew cache TTL: unknown variant `max`, expected one of `none`, `minimal`, `low`, `medium`, `high`, `xhigh` at line 29 column 25\n2026-07-15T10:25:22.630413Z ERROR codex_models_manager::manager: failed to renew cache TTL: unknown variant `max`, expected one of `none`, `minimal`, `low`, `medium`, `high`, `xhigh` at line 29 column 25\n2026-07-15T10:25:27.916516Z ERROR codex_models_manager::manager: failed to renew cache TTL: unknown variant `max`, expected one of `none`, `minimal`, `low`, `medium`, `high`, `xhigh` at line 29 column 25\n2026-07-15T10:25:33.725302Z ERROR codex_models_manager::manager: failed to renew cache TTL: unknown variant `max`, expected one of `none`, `minimal`, `low`, `medium`, `high`, `xhigh` at line 29 column 25\n",
          "trace": [
            {
              "event": "pre_provider_verifier",
              "status": "fail"
            },
            {
              "event": "thread.started"
            },
            {
              "event": "turn.started"
            },
            {
              "event": "item.completed",
              "item_type": "agent_message",
              "message": "Using the `adlc` skill for a bounded Fix flow. I\u2019m loading the skill contract, then I\u2019ll run the exact verifier first to establish the failing arithmetic-mean test before inspecting only the relevant code and test."
            },
            {
              "command": "/bin/zsh -lc \"sed -n '1,220p' <WORKSPACE>/.agents/skills/adlc/SKILL.md\"",
              "event": "item.started",
              "exit_code": null,
              "item_type": "command_execution"
            },
            {
              "command": "/bin/zsh -lc \"sed -n '1,220p' <WORKSPACE>/.agents/skills/adlc/SKILL.md\"",
              "event": "item.completed",
              "exit_code": 0,
              "item_type": "command_execution"
            },
            {
              "command": "/bin/zsh -lc 'python3 <WORKSPACE>/.agents/skills/adlc/scripts/context.py --workspace <WORKSPACE> --target <WORKSPACE> --command fix'",
              "event": "item.started",
              "exit_code": null,
              "item_type": "command_execution"
            },
            {